question_id,topic,difficulty,is_active,question_text,reference_law,reference_book,feedback,image,total_options,correct_option_indexes,option_1_text,option_1_is_correct,option_2_text,option_2_is_correct,option_3_text,option_3_is_correct,option_4_text,option_4_is_correct,option_5_text,option_5_is_correct,option_6_text,option_6_is_correct
321,LIBRO PARA LA CONDUCCIÓN EN CHILE(CONASET),1,si,¿Cual es la distancia que debe mantener un conductor respecto del vehículo que va adelante?,Neblina,,"Para mantener la distancia adecuada con el vehículo que va adelante, se recomienda seguir estas pautas:
En zonas urbanas, la distancia mínima recomendada es aproximadamente la mitad de la regla de los tres segundos, que es de tres segundos entre vehículos. 

En carreteras, se sugiere mantener una distancia de seguridad equivalente al tiempo que tarda un vehículo en frenar, que es de aproximadamente 2 a 3 segundos. 

La distancia de seguridad también depende de factores como la velocidad, las condiciones del clima (lluvia, neblina) y el estado del vehículo. 

En general, se recomienda dejar al menos 100 metros de distancia con el vehículo que te precede, especialmente en condiciones de alta velocidad o tráfico denso. 


Es fundamental ajustar la distancia según las condiciones del entorno y tu propio estado de conducción.",,3,3,30 metros.,no,10 metros.,no,"Una distancia razonable y prudente, que permita anticiparse a acciones riesgo, ejecutadas  por otros conductores.",si,,,,,,
322,LIBRO PARA LA CONDUCCIÓN EN CHILE(CONASET),1,si,¿Que focos de luces se prohíben?,Uso general de luces,,"Todos los focos o luces que induzcan a error en la conducción. Esto significa que cualquier iluminación adicional o distinta a las reglamentarias que pueda confundir a otros conductores o peatones está fuera de la norma. Los puntos clave de esta prohibición incluyen:
Luces no reglamentarias: Se prohíbe el uso de focos o dispositivos luminosos, fijos o giratorios (como balizas), excepto en vehículos de emergencia o autorizados por reglamento.
Colores prohibidos: No se permiten luces de colores distintos al blanco o amarillo en la parte delantera, ni colores que no sean rojo o amarillo (intermitentes) en la parte trasera.
Obstrucción de patentes: Según la reciente Ley 21.601, está estrictamente prohibido instalar luces o accesorios que dificulten la plena percepción de la placa patente.
Luces estroboscópicas: El uso de luces que parpadeen o simulen patrullas oficiales está prohibido para vehículos particulares.
",,3,3,Los neblineros.,no,Los busca camino.,no,Todos los que induzca a error en la conducción.,si,,,,,,
323,LIBRO PARA LA CONDUCCIÓN EN CHILE(CONASET),1,si,¿En que condiciones debe estar la rueda de repuesto?,Reventón y adherencia,,,,3,1,En buen estado.,si,Re dibujada.,no,Recauchada.,no,,,,,,
324,LIBRO PARA LA CONDUCCIÓN EN CHILE(CONASET),1,si,¿En que condiciones normales un vehículo podrá ser conducido marcha atrás?,Control y maniobra,," En condiciones normales, un vehículo podrá ser conducido marcha atrás únicamente para mantener la libre circulación, para incorporarse al flujo de tránsito o para estacionar. De acuerdo con la normativa, esta maniobra debe realizarse siempre:
En la distancia mínima necesaria.
Sin cruzar una intersección (a menos que exista una indicación expresa de Carabineros o sea estrictamente indispensable).
Habiendo verificado que no existe peligro para otros usuarios de la vía.
",,3,3,50 metros.,no,30 metros.,no,Para mantener la libre circulación o para estacionar un vehículo.,si,,,,,,
325,LIBRO PARA LA CONDUCCIÓN EN CHILE(CONASET),1,si,"¿Que vehículo deberá respetar el derecho preferente de paso de los demás vehículo, cuando el cruce no esta regulado o señalizado?",Paso peatonal,,"Cruces e Intersecciones: Según la Ley de Tránsito, el vehículo que se aproxima a un cruce debe ceder el paso al vehículo que se acerque por la derecha. Esto significa que si un vehículo está a la izquierda de otro, debe esperar a que el vehículo de la derecha pase primero. 

Maniobras de Viraje: Cuando un vehículo va a girar, no tiene preferencia y debe ceder el paso a los vehículos que continúan recto y a los peatones que crucen por pasos reglamentarios. Es fundamental señalizar con anticipación y ajustar la velocidad antes de realizar el giro. 

Vehículos de Emergencia: Los vehículos de emergencia, como ambulancias y camiones de bomberos, tienen preferencia de paso en todas las circunstancias. Los demás vehículos deben cederles el paso inmediatamente. 

Señales de Tránsito: En cruces donde hay señales de ""PARE"" o ""CEDA EL PASO"", los conductores deben respetar estas indicaciones y ceder el paso según lo indicado",questions/cruce.png,3,1,El que va a virar a la izquierda.,si,El que va a virar a la derecha.,no,El que sigue derecho.,no,,,,,,
326,LIBRO PARA LA CONDUCCIÓN EN CHILE(CONASET),1,si,Velocidad razonable y prudente significa:,Lluvia y aquaplaning,,"La velocidad razonable y prudente es aquella que permite al conductor mantener el control total del vehículo en todo momento. Esto implica no solo respetar los límites de velocidad establecidos, sino también adaptar la velocidad a las condiciones reales de la carretera, el clima, la visibilidad y la densidad del tráfico. Por ejemplo, en condiciones de lluvia intensa o baja visibilidad, es necesario reducir la velocidad, incluso si el límite legal permite una velocidad mayor.",,3,2,30 km/H,no,La velocidad razonable y prudente es aquella que permite al conductor mantener el control total del vehículo en todo momento.,si,50km/h,no,,,,,,
327,LIBRO PARA LA CONDUCCIÓN EN CHILE(CONASET),1,si,¿Que debe hacer usted al ser adelantado?,Uso general de luces,," Al ser adelantado, usted debe cumplir con dos obligaciones principales para facilitar la maniobra:

Mantenerse lo más cerca posible del borde derecho de la calzada.

No aumentar la velocidad de su vehículo hasta que el otro conductor haya completado la maniobra y haya regresado a su pista.
En caso de que se presente un peligro inesperado para el conductor que está adelantando, usted debe colaborar reduciendo la velocidad o incluso frenando para que él pueda reincorporarse de forma segura.",,3,3,Encender sus luces bajas.,no,Frenar.,no,"Mantener o disminuir la velocidad, para permitir el adelantamiento.",si,,,,,,
328,LIBRO PARA LA CONDUCCIÓN EN CHILE(CONASET),1,si,Si observa que en la parte trasera de un vehículo se encienden luces blancas. ¿Que indican?,Uso general de luces,,"Las luces blancas en la parte trasera indican que el vehículo está circulando o se dispone a circular marcha atrás. Estas luces tienen dos funciones principales:

Advertir a los demás conductores y peatones que el vehículo se moverá en retroceso.

Iluminar la zona posterior para que el conductor tenga mejor visibilidad al realizar la maniobra.",,3,3,Se va a estacionar.,no,Va a virar.,no,Va a retroceder.,si,,,,,,
329,LIBRO PARA LA CONDUCCIÓN EN CHILE(CONASET),1,si,En la vías rurales. ¿Cual es la forma general para estacionar?,Lugares y reglas de estacionamiento,,"En las vías rurales, la forma general para estacionar es hacerlo fuera de la calzada, situando el vehículo completamente sobre la berma derecha en el sentido de la circulación. Si no existe berma, debe buscar un lugar donde el vehículo no obstaculice el tránsito y sea visible para los demás conductores. Recuerde que está estrictamente prohibido estacionar sobre la calzada, ya que esto representa un riesgo grave de colisión.                                                                                                                                                                                                                                                                                                                       ",,3,1,Con toda la estructura del vehículo sobre la berma.,si,Sobre la calzada en sentido del tránsito.,no,Longitudinalmente con la mitad del vehículo sobre la berma.,no,,,,,,
330,LIBRO PARA LA CONDUCCIÓN EN CHILE(CONASET),1,si,¿Que obligación le corresponde a usted al ir circulando y enfrentar a otro vehículo que transita en sentido contrario?,Virajes,,"Al enfrentar a otro vehículo que transita en sentido contrario, su obligación principal es mantenerse hacia el lado derecho de la calzada para dejar el mayor espacio posible y permitir el cruce seguro. Además, debe cumplir con lo siguiente:
No traspasar el eje de la calzada: Debe mantenerse estrictamente en su pista de circulación.
Ajustar luces: Si es de noche o hay baja visibilidad, debe cambiar sus luces altas por bajas a una distancia prudente (aproximadamente 200 metros) para evitar deslumbrar al otro conductor.
Reducir la velocidad: Si el camino es estrecho o las condiciones son difíciles, debe disminuir la velocidad para realizar el cruce con precaución.
",,3,1,"Circular por la derecha, alejándose del eje de calzada.",si,Hacer cambio de luces.,no,Reducir la velocidad.,no,,,,,,
331,LIBRO PARA LA CONDUCCIÓN EN CHILE(CONASET),1,si,Al estar las pistar de la calzada demarcadas. ¿Por donde debe circular con su vehículo?,Ubicación en pista,,"Al estar las pistas de la calzada demarcadas, debes circular dentro de la franja demarcada para la pista. Esto asegura que tu vehículo esté dentro de la pista de circulación designada, lo que contribuye a un tránsito más seguro y ordenado, además, por norma general circula por tu derecha.",,3,3,Por la pista izquierda.,no,Por cualquier pista.,no,Por la pista derecha.,si,,,,,,
332,LIBRO PARA LA CONDUCCIÓN EN CHILE(CONASET),1,si,"Si, se revienta un neumático usted:",Reventón y adherencia,,"No frene bruscamente: eso puede hacer que el vehículo pierda aún más estabilidad.

Sujete firme el volante: mantenga el control del vehículo y evite giros bruscos.

Quite el pie del acelerador: deje que el auto reduzca la velocidad de manera natural.

Encienda las luces de emergencia: para advertir a otros conductores.",,3,3,Frena.,no,Vira hacia el lado de la rueda reventada.,no,Mantiene la dirección en marcha y reduce la velocidad.,si,,,,,,
333,LIBRO PARA LA CONDUCCIÓN EN CHILE(CONASET),1,si,Si la parte trasera de su vehículo patina hacia un lado. ¿Que hace usted?,Control y maniobra,,"Suelte el acelerador y gire el volante en la misma dirección en la que se desliza la parte trasera. Si patina hacia la izquierda, gire el volante también hacia la izquierda.",,3,2,Frena.,no,Gira las ruedas en el mismo sentido de la patinada.,si,Mantiene la dirección delantera en sentido contrario a la patinada.,no,,,,,,
334,LIBRO PARA LA CONDUCCIÓN EN CHILE(CONASET),1,si,"Al acercarse a una señal ""Zona de escuela"" ¿Que debe hacer?",Prioridad en cruces,,"Al acercarse a una señal ZONA DE ESCUELA, debe:
Disminuir la velocidad. limite en zona de escuela 30km/h
Tener cuidado con los niños que puedan cruzar la calle.
Estar preparado para parar si es necesario.
Obedecer las señales de los guardias de cruce si están presentes.",,3,1,Disminuir la velocidad.,si,Tocar la bocina.,no,Aumentar la velocidad para salir rápido de la zona.,no,,,,,,
335,LIBRO PARA LA CONDUCCIÓN EN CHILE(CONASET),1,si,"¿circulando detecta que el vehículo se sobre calienta, puede deberse a:",Mantenimiento general,,"Si notas que la temperatura sube peligrosamente mientras conduces, generalmente se debe a una falla en el sistema de refrigeración. Según el Libro del Nuevo Conductor, las causas más comunes son: 
Falta de líquido refrigerante: Puede ser por una fuga en las mangueras, una rotura en el radiador o simplemente falta de mantenimiento.
Correa del ventilador rota o floja: Si la correa que mueve la bomba de agua o el ventilador falla, el sistema deja de circular el líquido o de enfriarlo.
Termostato pegado: Si esta válvula se queda cerrada, el refrigerante no puede pasar hacia el radiador para enfriarse.
Falla en el ventilador eléctrico: Si el sensor o el motor del ventilador no activan, el radiador no recibe aire suficiente, especialmente en tacos o ciudad.
Rejillas del radiador obstruidas: Suciedad, insectos o barro que impiden que el aire pase a través del radiador. 
¿Qué hacer en el momento?
Detente de inmediato: Busca un lugar seguro y apaga el motor.
NUNCA abras la tapa del radiador con el motor caliente; el vapor a presión puede causarte quemaduras graves.
Espera a que enfríe (al menos 30-40 minutos) antes de revisar niveles. 
",,3,1,Circuito refrigeración obstruido.,si,Insuficiente paso de agua caliente al radiador.,no,Batería baja.,no,,,,,,
336,LIBRO PARA LA CONDUCCIÓN EN CHILE(CONASET),1,si,Cuando un neumático tiene baja presión:,Presión e inflado,,"Tener un neumático con baja presión puede provocar una serie de problemas graves, incluyendo una conducción inestable, mayor desgaste del neumático, aumento del consumo de combustible y un mayor riesgo de pinchazos.

Efectos Negativos de la Baja Presión
Conducción Inestable: La baja presión en los neumáticos afecta la estabilidad del vehículo, especialmente en curvas y durante frenadas bruscas. Esto puede aumentar el riesgo de accidentes. 

Mayor Desgaste de los Neumáticos: Los neumáticos con baja presión tienden a desgastarse más rápidamente, especialmente en los bordes, lo que puede acortar su vida útil y requerir un reemplazo prematuro. 
2
Aumento del Consumo de Combustible: La resistencia a la rodadura aumenta cuando los neumáticos están desinflados, lo que obliga al motor a trabajar más y, por ende, incrementa el consumo de combustible. 

Riesgo de Pinchazos y  Reventones: La baja presión puede provocar un sobrecalentamiento del neumático, aumentando el riesgo de pinchazos o reventones, lo que puede ser extremadamente peligroso. 

Pérdida de Tracción: Un neumático poco inflado no proporciona la tracción adecuada, lo que puede afectar la capacidad de frenado y la adherencia al asfalto, especialmente en condiciones climáticas adversas",,3,1,La dirección tiende a irse hacia un lado.,si,El motor pierde potencia.,no,Se sobrecalienta el motor.,no,,,,,,
337,LIBRO PARA LA CONDUCCIÓN EN CHILE(CONASET),1,si,La falta de tensión en correa del ventilador produce:,Refrigeración,,"La falta de tensión de la correa del ventilador puede producir varias consecuencias graves:

Recalentamiento del motor: La correa es esencial para el funcionamiento del sistema de refrigeración, ya que impulsa la bomba de agua que circula el líquido refrigerante. 

Deslizamiento y desgaste: Si la tensión es demasiado baja, la correa puede deslizarse en la polea, provocando ruido, vibración y un aumento en el desgaste. 

Es fundamental mantener la tensión adecuada de la correa para evitar estos problemas.",,3,3,Perdida de potencia.,no,Desgaste de balatas y pastillas.,no,Recalentamiento del motor.,si,,,,,,
338,LIBRO PARA LA CONDUCCIÓN EN CHILE(CONASET),1,si,La función del embrague es:,Embrague y transmisión,,"En términos más técnicos, el embrague permite interrumpir momentáneamente la transmisión de par motor a las ruedas, lo que es esencial para:

Cambiar de marcha sin forzar el motor ni la caja de cambios.
Detener el vehículo sin apagar el motor.
Arrancar suavemente desde parado.

Al presionar el pedal del embrague, se interrumpe temporalmente la transmisión de potencia, lo que permite al conductor cambiar de marcha sin dañar los engranajes de la caja de cambios. 

Arrancar y detener el vehículo: Facilita el arranque suave del vehículo desde una posición de reposo y permite detenerse sin apagar el motor.",questions/embrague.png,3,3,Frenar el motor.,no,Darle fuerza al motor del vehículo.,no,"Conectar y desconectar ""La fuerza"" del motor",si,,,,,,
339,LIBRO PARA LA CONDUCCIÓN EN CHILE(CONASET),1,si,"""CRUCE REGULADO"" es aquel en que existe:",Prioridad en cruces,,"Un cruce regulado es aquel en el que existe un semáforo funcionando (excluyendo la luz amarilla intermitente) o un Carabinero dirigiendo el tránsito. Es importante notar que:
Las señales PARE o CEDA EL PASO no convierten un cruce en ""regulado""; en esos casos, se rige por las normas de prioridad de paso.
Si el semáforo está apagado o en amarillo intermitente, el cruce deja de ser regulado.
",,3,3,Señal pare o ceda el paso.,no,Semáforo intermitente.,no,Semáforo funcionando normalmente o carabineros dirigiendo el tránsito.,si,,,,,,
340,LIBRO PARA LA CONDUCCIÓN EN CHILE(CONASET),1,si,¿De que color deben ser las luces de viraje traseras?,Uso general de luces,,"Las luces de viraje traseras deben ser de color amarillo o rojo. Según la normativa de tránsito (basada en el Libro del Nuevo Conductor de Chile), los colores permitidos para las luces traseras son:
Luces de viraje: Amarillo o rojo.
Luces de freno: Rojo.
Luces de retroceso: Blanco.
Luces de posición: Rojo.
",,3,2,Blancas.,no,Rojas o amarillas.,si,Verdes.,no,,,,,,
341,LIBRO PARA LA CONDUCCIÓN EN CHILE(CONASET),1,si,¿En que parte del túnel se puede utilizar  la bocina?,Estrés y distracción,,"La bocina no se puede utilizar en ninguna parte del túnel, ni en su entrada o salida. La prohibición se basa en que los túneles son espacios cerrados donde el sonido se amplifica y produce ecos y reverberaciones, lo que puede confundir, asustar o desorientar a otros conductores. Además, este efecto acústico puede generar estrés o una reacción brusca en quienes circulan, aumentando el riesgo de siniestros en un entorno ya de por sí más complejo debido a la reducción de visibilidad y a la necesidad de mantener mayor concentración.",,3,3,En la entrada.,no,En la salida.,no,En ninguna parte.,si,,,,,,
342,LIBRO PARA LA CONDUCCIÓN EN CHILE(CONASET),1,si,La luz verde del semáforo indica:,Semáforos,,"La luz verde del semáforo indica paso. Frente a esta señal, usted puede continuar la marcha o virar (a menos que una señal lo prohíba), siempre considerando lo siguiente:
Espacio suficiente: No debe avanzar si no cuenta con al menos diez metros despejados después del cruce.
Preferencia: Debe ceder el paso a peatones o vehículos que aún se encuentren despejando la intersección.
Seguridad: Antes de iniciar la marcha, asegúrese de que no existan riesgos residuales de la fase anterior.
",,3,3,Precaución.,no,Pare.,no,Siga:,si,,,,,,
343,LIBRO PARA LA CONDUCCIÓN EN CHILE(CONASET),1,si,El adelantamiento se debe hacer por:,Velocidad legal y segura,,El adelantamiento se debe hacer siempre por la izquierda. La normativa establece que esta es la forma correcta y segura de realizar la maniobra. Existe una excepción muy específica: se puede pasar por la derecha cuando el vehículo alcanzado esté realizando o esté a punto de efectuar un viraje a la izquierda.,,3,1,El lado izquierdo.,si,Por el lado derecho.,no,Aumentando la velocidad al máximo.,no,,,,,,
344,LIBRO PARA LA CONDUCCIÓN EN CHILE(CONASET),1,si,¿Con que distancia de antelación usted deberá hacer la señal para efectuar un cambio de pista?,Ubicación en pista,,"Señaliza con suficiente anticipación cuando vayas a cambiar de pista...
La señal debe darse con tiempo suficiente antes de iniciar la maniobra pensada…
Ante un cambio de pista, no comiences a señalizar hasta que no tengas seguridad de que podrás realizar la maniobra.",,3,1,Con una distancia razonable y prudente.,si,Con 10 metros de antelación.,no,Con 20 metros de antelación,no,,,,,,
345,LIBRO PARA LA CONDUCCIÓN EN CHILE(CONASET),1,si,Línea de detención de vehículos es:,Semáforos,,"La línea de detención de vehículos es una línea transversal a la calzada, ya sea demarcada o imaginaria, que indica el lugar exacto donde los vehículos deben detenerse frente a una intersección o un paso de peatones. Esta línea no debe ser sobrepasada por los vehículos que deben detenerse antes de cruzar. Su principal objetivo es garantizar la seguridad en las intersecciones controladas por señales de tráfico o semáforos.",,3,1,"La línea imaginaría o demarcada , ubicada justo a mas de un metro del paso de peatones.",si,El paso de cebra.,no,Línea ubicada a menos de un metro después del paso de peatones.,no,,,,,,
346,LIBRO PARA LA CONDUCCIÓN EN CHILE(CONASET),1,si,¿Cuantos sistemas de frenos deben tener los vehículos?,Fallas de frenos,,"Freno de servicio (principal):

Se acciona mediante el pedal de freno.

Actúa sobre las ruedas delanteras y traseras, permitiendo detener el vehículo en movimiento.

Es el sistema más usado durante la conducción.

Freno de estacionamiento (secundario):

Se acciona manualmente, generalmente con una palanca o botón electrónico.

Actúa sobre las ruedas traseras.

Su función es mantener el vehículo inmóvil cuando está detenido o estacionado.",,3,1,Dos independientes.,si,Dos conectados.,no,Uno.,no,,,,,,
347,LIBRO PARA LA CONDUCCIÓN EN CHILE(CONASET),1,si,¿Que condición deben tener los vehículos de combustión interna para circular?,Primeros auxilios,,"Condiciones para circular con vehículos de combustión interna
Los vehículos de combustión interna deben cumplir con ciertas condiciones para poder circular por las vías públicas en Chile. Estas condiciones incluyen:
Vidrios de seguridad: Deben ser de seguridad y estar en buen estado.
Limpiaparabrisas: Deben estar instalados y funcionando correctamente.
Espejo interior regulable: Deben ser de regulación manual.
Velocímetro: Deben estar instalados y funcionando correctamente.
Parachoques delantero y trasero: Deben estar instalados y en buen estado.
Extintor de incendio: Deben estar instalados y en buen estado.
Dispositivos para casos de emergencia: Deben estar instalados y en buen estado.
Rueda de repuesto: Deben estar en buen estado y tener los elementos necesarios para su reemplazo.
Botiquín de primeros auxilios: Deben estar instalados y en buen estado.
Cuñas de seguridad: Deben estar instaladas y en buen estado.
Cinturones de seguridad: Deben estar instalados y en buen estado. 
Además, es obligatorio utilizar cinturón de seguridad en los asientos delanteros y traseros. Para los niños de hasta 8 años o de estatura de 135 centímetros y 33 kilos, deben utilizar sistemas de retención infantil en los asientos traseros. Los vehículos de transporte escolar y los servicios de transporte interurbano público o privado de pasajeros deben contar con cinturones de seguridad para cada uno de los asientos",,3,3,Neumáticos nuevos.,no,Turbo compresor.,no,Silenciador eficiente y sin escape libre.,si,,,,,,
348,LIBRO PARA LA CONDUCCIÓN EN CHILE(CONASET),1,si,La luz amarilla del semáforo indica:,Semáforos,,"La luz amarilla del semáforo indica prevención. Su función es advertir que la luz roja aparecerá a continuación. Ante esta señal, usted debe:
Detenerse antes de entrar al cruce, a menos que ya se encuentre dentro de él o esté tan cerca que no pueda frenar de forma segura.
Despejar la intersección si la luz cambia mientras usted ya está cruzando.
",,3,2,Pare.,no,Precaución.,si,Ceda el paso.,no,,,,,,
349,LIBRO PARA LA CONDUCCIÓN EN CHILE(CONASET),1,si,La velocidad máxima en carretera con más de una pista por sentido es:,Velocidad legal y segura,,La velocidad máxima en carretera con más de una pista por sentido es de 120 km/h. Este límite se aplica a vehículos livianos y se establece para garantizar la seguridad vial en carreteras no urbanas con dos o más pistas.,,3,1,120 km/h,si,100 km/h,no,90 km/h,no,,,,,,
350,LIBRO PARA LA CONDUCCIÓN EN CHILE(CONASET),1,si,La velocidad máxima en una carretera de una pista por sentido es:,Velocidad legal y segura,,"En zonas no urbanas, y cuando la calzada tiene sólo una pista por sentido, la velocidad máxima permitida a los vehículos livianos es de 100 km/h.",,3,1,100 km/h,si,90 km/h,no,120 km/h,no,,,,,,
351,LIBRO PARA LA CONDUCCIÓN EN CHILE(CONASET),1,si,¿Que parte de la vía se debe utilizar exclusivamente para circular con el vehículo?,Lugares y reglas de estacionamiento,,"La parte de la vía que se debe utilizar exclusivamente para circular con el vehículo es la calzada. Es importante distinguir los elementos de la vía para evitar confusiones en el examen:
Calzada: Parte de la vía destinada al uso de vehículos y animales.
Acera (Vereda): Parte de la vía destinada exclusivamente al tránsito de peatones.
Berma: Faja lateral pavimentada o no, adyacente a la calzada de un camino, que no está destinada al tránsito de vehículos salvo en situaciones de emergencia.
",,3,1,La calzada.,si,La berma.,no,La acera.,no,,,,,,
352,LIBRO PARA LA CONDUCCIÓN EN CHILE(CONASET),1,si,Al acercarse a una intersección usted debe:,Paso peatonal,,"Reducir la velocidad lo suficiente como para poder ceder el paso de manera segura si otro vehículo se acerca por su derecha. 

Ceder el paso a cualquier vehículo que haya llegado antes que usted o que esté en la intersección. 
Verificar el tráfico en todas las direcciones, incluyendo peatones y ciclistas, antes de continuar. 
Estar atento a las señales de tráfico y respetar las indicaciones de las señales de control de tráfico. 
Mantener una distancia de seguridad con el vehículo que le precede para evitar colisiones.",,3,1,debe llegar a  velocidad reducida.,si,Tocar la bocina.,no,Hacer cambio de luces.,no,,,,,,
353,LIBRO PARA LA CONDUCCIÓN EN CHILE(CONASET),1,si,El uso de la bocina es necesario solo:,Conducción responsable,,"El uso de la bocina es necesario solo para prevenir un accidente. Según la normativa de tránsito, su uso debe ser breve y está restringido únicamente a situaciones de emergencia. Está estrictamente prohibido utilizarla para:
Apurar a otros conductores.
Saludar a conocidos.
Manifestar molestia o rabia.
En zonas identificadas con la señal de ""Silencio"" (cerca de hospitales o colegios), a menos que sea para evitar una colisión inminente.
",,3,1,Para prevenir un accidente.,si,Para apurar al conductor de adelante.,no,Para indicar su urgencia.,no,,,,,,
