question_id,topic,difficulty,is_active,question_text,reference_law,reference_book,feedback,image,total_options,correct_option_indexes,option_1_text,option_1_is_correct,option_2_text,option_2_is_correct,option_3_text,option_3_is_correct,option_4_text,option_4_is_correct,option_5_text,option_5_is_correct,option_6_text,option_6_is_correct
174,LIBRO PARA LA CONDUCCIÓN EN CHILE(CONASET),1,si,Usted esta circulando por una vía rápida en buenas condiciones. ¿Cómo puede estar seguro de que lo hace a una distancia adecuada del vehículo que va adelante?,Distancia de reacción y frenado,,"Para estar seguro de que mantiene una distancia adecuada, debe aplicar la regla de los tres segundos.¿Cómo aplicarla?
Elija un punto de referencia fijo en la vía (como un árbol, un poste o una señal).
Cuando el vehículo de adelante pase por ese punto, comience a contar: ""mil uno, mil dos, mil tres"".
Si usted pasa por el mismo punto después de haber terminado de contar, su distancia es segura. Si llega antes, debe alejarse más.

Importante: En condiciones climáticas adversas (lluvia, neblina) o de noche, se recomienda duplicar este tiempo a 6 segundos.¿Te gustaría saber cómo calcular la distancia de detención si tuvieras que frenar de emergencia en esa vía",,4,3,La distancia entre usted y el vehículo que va adelante debería ser dos veces el largo de su vehículo.,no,La distancia entre usted y el vehículo que va adelante debería ser igual a su distancia de frenado.,no,La distancia entre usted y el vehículo que va adelante debería ser a lo menos igual a la que usted recorre en tres segundos.,si,La distancia en usted y el vehículo que va adelante debería ser a lo menos igual a la que usted recorre en un segundo.,no,,,,
175,LIBRO PARA LA CONDUCCIÓN EN CHILE(CONASET),1,si,El conductor detrás suyo le sigue muy de cerca. ¿Que hace usted?,Velocidad legal y segura,,"Si un conductor le sigue demasiado cerca (técnica conocida como tailgating), usted debería realizar las siguientes acciones por seguridad:
Aumentar su propia distancia de seguridad con respecto al vehículo que va delante de usted. Esto le permitirá frenar de forma más suave si ocurre un imprevisto, evitando que el conductor de atrás le choque por alcance.
Mantener una velocidad constante o disminuirla levemente para facilitar que el conductor de atrás lo adelante si así lo desea.
No frenar bruscamente de forma intencional para ""asustar"" al otro conductor, ya que esto podría provocar un accidente innecesario.
Señalizar con anticipación cualquier maniobra de giro o detención
",,4,3,Señaliza a la derecha y le indica con la mano para que lo adelante.,no,Disminuye la velocidad y le permite que lo adelante.,no,No hace nada y se mantiene dentro del limite de velocidad,si,Se acerca hacia el centro de la calzada.,no,,,,
176,LIBRO PARA LA CONDUCCIÓN EN CHILE(CONASET),1,si,Un bus esta detenido en una parada delante suyo. El intermitente izquierdo del bus está parpadeando. ¿Qué hace usted?,Conducción responsable,,"Debe disminuir la velocidad y, si es seguro hacerlo, ceder el paso para permitir que el bus se reintegre a la circulación. El intermitente izquierdo indica que el conductor del bus tiene la intención de salir de la parada. Facilitar esta maniobra es una norma de cortesía y seguridad vial que ayuda a la fluidez del transporte público.",,4,4,Hace parpadear sus luces delanteras y disminuye la velocidad,no,Toca la bocina y continua.,no,Disminuye la velocidad y luego toca la bocina.,no,"Disminuye la velocidad y cede el paso al bus, siempre que ello sea seguro.",si,,,,
177,LIBRO PARA LA CONDUCCIÓN EN CHILE(CONASET),1,si,Usted va conduciendo en una carretera a la velocidad máxima permitida. El conductor que viene detrás suyo está tratando de adelantarlo. ¿Que hace usted?,Maniobra de adelantamiento,,"Debe facilitar el adelantamiento manteniéndose lo más a la derecha posible y no aumentar su velocidad. Aunque usted ya circule al límite permitido, no le corresponde impedir la maniobra del otro conductor. Aumentar la velocidad en este momento es peligroso y está prohibido, ya que prolonga el tiempo que el otro vehículo pasa en la pista contraria (o en la pista de adelantamiento), aumentando el riesgo de accidente.",,4,4,Se acerca más al vehículo de adelante para que el conductor que viene atrás no tenga espacio suficiente para adelantarlo.,no,"Le hace señas al conductor de atrás para que lo adelante, cuando sea seguro hacerlo.",no,Acelera para alejarse del conductor de atrás..,no,Mantiene o disminuye la velocidad y permite el adelantamiento.,si,,,,
178,LIBRO PARA LA CONDUCCIÓN EN CHILE(CONASET),1,si,Usted se está aproximando a un cruce cuando sorpresivamente un vehículo ingresa a la vía por la usted va y se ubica delante suyo. ¿Qué hace usted?,Prioridad en cruces,,"Usted debe disminuir la velocidad y estar preparado para frenar, manteniendo la calma. En esta situación, lo más importante es restablecer una distancia de seguridad adecuada con respecto al vehículo que acaba de ingresar. No debe tocar la bocina de forma agresiva ni intentar adelantar de inmediato, ya que el otro conductor podría realizar otra maniobra inesperada.",,4,2,Lo esquiva y toca la bocina.,no,Disminuye la velocidad y esta preparado para detenerse.,si,Enciende y apaga sus luces delanteras y continúa muy cerca detrás de él,no,Acelera pasándolo inmediatamente.,no,,,,
179,LIBRO PARA LA CONDUCCIÓN EN CHILE(CONASET),1,si,usted va conduciendo a la velocidad máxima permitida. Un vehículo se acerca muy rápido por atrás encendiendo y apagando sus luces. ¿Que hace usted?,Uso general de luces,,"Usted debe permitirle el paso, moviéndose hacia la derecha en cuanto sea seguro hacerlo. Aunque usted ya circule al límite de velocidad, no debe intentar ""bloquear"" al otro vehículo ni actuar como autoridad. Lo más seguro para evitar un accidente o un incidente de violencia vial es:
Mantener la calma.
No aumentar la velocidad.
Facilitar que el otro conductor lo sobrepase para que se aleje de su vehículo.
",,4,3,Acelera para mantener un espacio adecuado detrás suyo.,no,Presiona el freno para mostrar sus luce de freno.,no,Le permite el adelantamiento.,si,Aumenta su velocidad y le impide  que lo adelante.,no,,,,
180,LIBRO PARA LA CONDUCCIÓN EN CHILE(CONASET),1,si,Un espacio entre usted y el vehículo que marcha delante igual a lo que usted recorre en tres segundos es suficiente cuando...,Riesgos del entorno vial,,,,4,1,las condiciones climáticas son buenas.,si,está lloviendo fuertemente.,no,recién ha cesado de llover.,no,hay neblina.,no,,,,
181,LIBRO PARA LA CONDUCCIÓN EN CHILE(CONASET),1,si,Usted está conduciendo al limite de la velocidad máxima permitida y un conductor intenta adelantarlo. ¿Trataría usted de evitar que lo adelante?,Maniobra de adelantamiento,,"No, usted nunca debe tratar de evitar que lo adelanten. Independientemente de que usted ya circule al límite de velocidad, su deber es facilitar la maniobra del otro conductor. Intentar bloquear un adelantamiento es peligroso, aumenta el riesgo de una colisión frontal para el otro vehículo y puede generar situaciones de agresividad vial. Lo correcto es:
Mantener su velocidad o disminuirla levemente.
Ceñirse al borde derecho de la calzada.
",,4,4,"No, a monos que sea seguro hacerlo.",no,Si. porque el otro conductor está actuando en forma peligrosa.,no,"Si, porque el otro conductor está infringiendo la ley.",no,"No, en ningún momento.",si,,,,
182,LIBRO PARA LA CONDUCCIÓN EN CHILE(CONASET),1,si,"Delos siguientes factores, ¿Cual es el que con mayor frecuencia se presenta en las colisiones por la parte trasera?",Prioridad en cruces,,"El factor que se presenta con mayor frecuencia en las colisiones por la parte trasera (choques por alcance) es conducir demasiado cerca del vehículo que va adelante, no manteniendo una distancia de seguridad adecuada. A esto se suma a menudo la distracción del conductor, lo que impide reaccionar a tiempo cuando el vehículo precedente frena bruscamente.",,4,1,El conductor demasiado cerca del vehículo que va adelante.,si,El cambio repentino de las luces de los semáforos.,no,La existencia de peatones que cruzan en áreas muy concurridas.,no,El detenerse en todos los cruces.,no,,,,
183,LIBRO PARA LA CONDUCCIÓN EN CHILE(CONASET),1,si,Usted esta esperando incorporarse a una vía principal desde una calle lateral. ¿por que razón debería usted poner especial atención a las motocicletas?,Incorporación a la vía,,"Debería poner especial atención a las motocicletas principalmente porque son pequeñas y difíciles de ver, lo que hace que sea muy fácil pasarlas por alto al mirar el tráfico. Otras razones críticas son:
Velocidad engañosa: Es más difícil juzgar la velocidad a la que se aproxima una motocicleta en comparación con un automóvil.
Puntos ciegos: Pueden quedar ocultas fácilmente por los pilares del parabrisas de su vehículo o por otros autos.
Maniobrabilidad: Pueden cambiar de pista rápidamente o circular entre vehículos, apareciendo de forma sorpresiva.

¿Sabía que la mayoría de las colisiones con motociclistas en cruces ocurren porque el conductor del automóvil no los vio?",,4,3,Porque generalmente las motocicletas circulan más rápido que los autos.,no,Porque las patrullas de carabineros suelen andan en motocicletas.,no,Porque las motocicletas son pequeñas y difíciles de ver.,si,Porque las motocicletas tienen el derecho preferente de paso.,no,,,,
184,LIBRO PARA LA CONDUCCIÓN EN CHILE(CONASET),1,si,¿Cuál de los siguientes grupos de conductores tiene mayores probabilidades de verse involucrado en un accidente de tránsito?,Actuación en accidentes,,"El grupo que tiene mayores probabilidades de verse involucrado en un accidente de tránsito es el de los conductores jóvenes, específicamente aquellos que están en el rango de entre 18 y 29 años. Esto se debe principalmente a factores como:
Falta de experiencia al volante.
Mayor disposición al riesgo y exceso de confianza.
Influencia de la presión de grupo.
Baja percepción del peligro en situaciones críticas.
",,4,1,Los que tienen menos de 25 años.,si,Los que tienen entre 36 y 45 años.,no,Los que tienen entre 46 y 55 años.,no,Los que tienen mas de 55 años.,no,,,,
185,LIBRO PARA LA CONDUCCIÓN EN CHILE(CONASET),1,si,"En una zona rural, usted va conduciendo por un camino muy angosto. ¿Donde le resultaría más difícil ver personas a caballo que avanzan delante suyo?",Riesgos del entorno vial,,"Le resultaría más difícil ver personas a caballo justo después de una curva o al pasar la cima de una cuesta (rasante).En caminos rurales angostos, estos elementos del relieve y la geometría de la vía bloquean su campo visual, ocultando obstáculos o jinetes que circulan a baja velocidad. Por ello, siempre debe reducir la velocidad al aproximarse a estos puntos.",,4,4,Al ir usted bajando.,no,Al ir ellas subiendo un cerro.,no,Al ir usted en una curva a la izquierda.,no,Al ir usted en una curva a la derecha.,si,,,,
186,LIBRO PARA LA CONDUCCIÓN EN CHILE(CONASET),1,si,Usted va detrás de un camión articulado que se aproxima a un cruce. Su conductor señaliza hacia la derecha pero el vehículo se desplaza hacia la izquierda. ¿Que debe hacer usted?,Prioridad en cruces,,"Usted debe mantenerse detrás del camión y esperar a que este complete su maniobra. Es muy común que los vehículos de gran longitud (como camiones articulados o buses) necesiten desplazarse hacia la izquierda antes de virar a la derecha. Esto lo hacen para evitar que las ruedas traseras se suban a la cuneta o golpeen algún obstáculo en la esquina debido al radio de giro del remolque. Recomendaciones clave:
No intente sobrepasar por la derecha: Aunque vea un espacio libre, el camión lo cerrará rápidamente al momento de girar, lo que podría causar una colisión grave.
Mantenga la distancia: El conductor del camión tiene puntos ciegos amplios; si usted está muy cerca, no podrá verlo.
",questions/p-186.png,4,2,Advertirle al conductor acerca de su señal equivocada.,no,Esperar detrás del camión.,si,Denunciar a carabineros.,no,Pasar al camión por la derecha.,no,,,,
187,LIBRO PARA LA CONDUCCIÓN EN CHILE(CONASET),1,si,"En una carretera de doble calzada con dos pistas por sentido de tránsito, usted desea pasar el vehículo que va delante suyo, por su espejo retrovisor ve que el auto que viene atrás se esta cambiando de pista para sobrepasarlo a usted. ¿Que debería hacer usted?",Espejos y puntos ciegos,,"En esta situación, antes de iniciar la maniobra, lo primero que debe hacer es verificar por su espejo retrovisor que ningún otro vehículo haya comenzado a sobrepasarlo a usted. Los pasos correctos para realizar esta maniobra de forma segura son:
Observar: Mirar por los espejos (interior y lateral izquierdo) y verificar el punto ciego girando levemente la cabeza.
Señalizar: Encender la luz de giro izquierda con anticipación para advertir su intención.
Maniobrar: Cambiarse a la pista izquierda solo cuando esté seguro de que hay espacio suficiente y no viene nadie a alta velocidad por esa pista.
Regresar: Una vez que haya pasado al vehículo, señalice a la derecha y vuelva a su pista original cuando pueda ver al vehículo sobrepasado en su espejo retrovisor interior.

¿Sabías que en una vía de dos pistas por sentido esta maniobra se llama sobrepasar y no adelantar, porque no invades el sentido contrario? ",,4,4,Señalizar y luego cambiar de pista al sobrepasar.,no,Señalizar para indicarle al conductor que viene atrás que usted también desea  sobrepasar.,no,Presionar levemente el pedal de frenos para mostrar sus luces de freno.,no,No señalizar hasta que el auto lo haya pasado.,si,,,,
188,LIBRO PARA LA CONDUCCIÓN EN CHILE(CONASET),1,si,Un vehículo emerge sorpresivamente desde una vía lateral situándose delante suyo y obligándolo a frenar fuertemente. ¿Que hace usted?,Conducción responsable,,"Ante una situación de riesgo causada por otro conductor, usted debe mantener la calma y evitar reaccionar con ira. Lo correcto es:
Frenar firmemente para evitar la colisión.
Restablecer una distancia segura de seguimiento una vez que el peligro haya pasado.
No tocar la bocina de forma agresiva ni hacer gestos que puedan escalar el conflicto.
",,4,2,"Enciende y apaga sus luces para ,manifestar su enojo.",no,Ignora el error y permanece calmado.,si,Toca la bocina para demostrar su enojo.,no,Lo adelanta dejándolo atrás lo antes posible.,no,,,,
189,LIBRO PARA LA CONDUCCIÓN EN CHILE(CONASET),1,si,"Usted se detiene ante un cruce de cebra. En la vereda hay peatones esperando, pero ellos no comienzan a cruzar. ¿Que hace usted?",Paso peatonal,,"Usted debe tener paciencia y esperar. Aunque los peatones no hayan comenzado a caminar, ellos tienen el derecho preferente de paso en un cruce de cebra. Muchas veces, los peatones esperan a que el vehículo se detenga por completo para sentirse seguros antes de bajar a la calzada. Acciones que NO debe realizar:
No les toque la bocina: Esto puede asustarlos o presionarlos a cruzar de forma insegura.
No prosiga su marcha: Podrían decidir cruzar justo cuando usted acelera, provocando un accidente.
No haga señas con la mano: Usted no puede asegurar que no venga otro vehículo por la pista de al lado que pueda atropellarlos.

¿Sabía que no ceder el paso a un peatón en un cruce preferencial se considera una infracción gravísima en Chile?",,4,2,Les toca la bocina para apurarlos.,no,Tiene paciencia y espera .,si,Prosigue su marcha.,no,Les hace señas con la mano apurándolos para que crucen.,no,,,,
190,LIBRO PARA LA CONDUCCIÓN EN CHILE(CONASET),1,si,Cuando el viento sopla muy fuerte usted necesita tener especial cuidado....,Técnica de frenado,,"Cuando el viento sopla muy fuerte, usted necesita tener especial cuidado al pasar cerca de ciclistas (o motociclistas).Esto se debe a que las ráfagas de viento pueden hacer que estos usuarios pierdan el equilibrio o se desvíen de su trayectoria, por lo que es fundamental dejar un espacio lateral extra al adelantarlos. Otras situaciones críticas incluyen:
Al adelantar vehículos pesados: Por el ""efecto pantalla"" que ocurre al entrar y salir de su zona de sombra.
Al salir de un túnel: Debido al cambio repentino de la fuerza del viento lateral.
En caminos de montaña: Donde las ráfagas pueden ser más violentas e impredecibles.

¿Sabías que para corregir las desviaciones por el viento debes sujetar el volante con firmeza y girarlo levemente en contra de la dirección del viento?",,4,4,al usar los frenos.,no,al comenzar a subir una pendiente.,no,al virar hacia un camino.,no,al pasar cerca de ciclistas.,si,,,,
191,LIBRO PARA LA CONDUCCIÓN EN CHILE(CONASET),1,si,En un cruce hay peatones cruzando la calle hacia la cual usted esta virando. ¿Que debe hacer usted?,Paso peatonal,,"Usted debe esperar y cederles el paso, ya que el peatón siempre tiene la preferencia sobre el vehículo que vira. Esta regla es fundamental: siempre que usted realice un viraje (ya sea a la derecha o a la izquierda) y haya peatones cruzando la calle hacia la cual usted va a entrar, ellos tienen la prioridad de paso, exista o no un paso de cebra marcado.",,4,3,Hacerles señas con la mano para que continúen.,no,Tocar la bocina para hacerles notar que usted esta ahí.,no,Esperar que crucen.,si,Encender sus luces de advertencia de peligro.,no,,,,
192,LIBRO PARA LA CONDUCCIÓN EN CHILE(CONASET),1,si,En un cruce hay peatones atravesando la calle hacia la cuál usted está virando. ¿Que hace usted?,Paso peatonal,,"Usted debe esperar y cederles el paso, ya que el peatón siempre tiene la preferencia sobre el vehículo que vira. Esta regla es fundamental: siempre que usted realice un viraje (ya sea a la derecha o a la izquierda) y haya peatones cruzando la calle hacia la cual usted va a entrar, ellos tienen la prioridad de paso, exista o no un paso de cebra marcado.",questions/p-191.png,4,1,Espera permitiéndoles que crucen.,si,Continúa ya que usted tiene el derecho preferente de paso.,no,Les hace señas para que retrocedan.,no,les toca la bocina para advertirles su presencia.,no,,,,
193,LIBRO PARA LA CONDUCCIÓN EN CHILE(CONASET),1,si,¿Donde debe tener especial cuidado con los motociclistas?,Sobrepaso de ciclistas,,"Debe tener especial cuidado con los motociclistas principalmente en los cruces e intersecciones. Al ser vehículos pequeños, es muy fácil que queden ocultos en los puntos ciegos o que su velocidad sea mal calculada. Otros lugares y situaciones críticas incluyen:
Al cambiar de pista: Pueden estar circulando entre los vehículos o en los costados.
Al abrir la puerta del vehículo: Si está estacionado, siempre debe mirar por el espejo y sobre el hombro.
En condiciones de viento fuerte: Las ráfagas pueden desestabilizarlos y hacer que cambien de trayectoria repentinamente.
Detrás de vehículos grandes: Porque estos ocultan la presencia de la motocicleta que viene más atrás.
",,4,2,En una estación de servicio.,no,En los cruces de calles.,si,En las proximidades de un área de servicio.,no,Al ingresar a un recinto o área de servicio.,no,,,,
194,LIBRO PARA LA CONDUCCIÓN EN CHILE(CONASET),1,si,Cuando conduce en la ciudad ¿Por qué razón debería usted tener cuidado al cruzarse con un bus que se encuentra detenido en una parada?,Lugares y reglas de estacionamiento,,"Deberías tener especial cuidado principalmente porque el bus puede ocultar a peatones que intenten cruzar la calle por delante de él. Al estar detenido, el gran tamaño del bus bloquea tu visión y la de los pasajeros que bajan, quienes podrían aparecer sorpresivamente en tu pista. Además, existen otras razones importantes:
Peatones que corren para alcanzarlo: Personas que cruzan la calle descuidadamente desde el otro lado para no perder el bus.
Salida repentina del bus: El conductor del bus podría señalizar y ponerse en movimiento hacia tu pista de forma inesperada
",,4,3,Porque el bus puede estar en pana.,no,Porque el bus puede ponerse en movimiento repentinamente.,no,Porque pueden aparecer peatones detrás del bus.,si,Porque el bus puede permanecer detenido.,no,,,,
195,LIBRO PARA LA CONDUCCIÓN EN CHILE(CONASET),1,si,Usted se encuentra muy próximo a un cruce en el que pretende virar a la derecha. Delante suyo va un ciclista. ¿Que hace usted?,Prioridad en cruces,,"Usted debe mantenerse detrás del ciclista y esperar a que este pase la intersección antes de realizar el viraje. Nunca debe adelantar al ciclista justo antes de doblar, ya que esto podría provocar que lo ""encierre"" o colisione con él durante la maniobra de giro (accidente conocido como ""gancho a la derecha"").Pasos correctos:
Reducir la velocidad y acomodar su ritmo al del ciclista.
Señalizar con la debida anticipación.
Virar solo cuando el ciclista haya despejado el cruce o usted tenga una distancia de seguridad suficiente que no lo ponga en riesgo.
",,4,3,Adelanta al ciclista antes del cruce.,no,Rodea al ciclista en el cruce.,no,Se mantiene detrás del ciclista hasta que éste haya pasado la intersección.,si,"se sitúa al lado del ciclista, sigue en la línea recta y desiste de virar.",no,,,,
196,LIBRO PARA LA CONDUCCIÓN EN CHILE(CONASET),1,si,Usted va conduciendo por un camino de doble tránsito cuando se encuentra con personas que van a caballo delante suyo. ¿Qué es lo primero que usted debería hacer?,Virajes,,"Lo primero que debe hacer es reducir la velocidad y mantener una distancia prudente. Al encontrarse con jinetes o animales en la vía, es fundamental seguir estas reglas de seguridad:
No tocar la bocina: Los ruidos fuertes pueden asustar al caballo, provocando reacciones imprevistas que pongan en riesgo al jinete y a usted.
No acelerar el motor: El ruido del escape también puede inquietar al animal.
Dejar un amplio espacio lateral: Al adelantarlos, hágalo lentamente y con la mayor separación posible.
Estar atento a señales del jinete: A veces los jinetes hacen señas con la mano si el animal está muy nervioso.
",questions/p-196.png,4,4,Desplazarse hacia el centro de la calzada.,no,Acelerar alrededor de ellos.,no,Señalizar hacia la izquierda.,no,Prepararse para reducir la velocidad.,si,,,,
197,LIBRO PARA LA CONDUCCIÓN EN CHILE(CONASET),1,si,¿Como debería usted adelantar a personas que van a caballo?,Maniobra de adelantamiento,,"Lo primero que debe hacer es reducir la velocidad y mantener una distancia prudente. Al encontrarse con jinetes o animales en la vía, es fundamental seguir estas reglas de seguridad:
No tocar la bocina: Los ruidos fuertes pueden asustar al caballo, provocando reacciones imprevistas que pongan en riesgo al jinete y a usted.
No acelerar el motor: El ruido del escape también puede inquietar al animal.
Dejar un amplio espacio lateral: Al adelantarlos, hágalo lentamente y con la mayor separación posible.
Estar atento a señales del jinete: A veces los jinetes hacen señas con la mano si el animal está muy nervioso.
",questions/p-196_DUoXZe8.png,4,1,Conduciendo lentamente y dejando bastante espacio lateral.,si,Pasando cerca de ellas y adelantándolas lo antes posible.,no,"La velocidad no es importante, pero si dejar suficiente espacio lateral.",no,Tocando la bocina sólo una vez como señal de advertencia.,no,,,,
198,LIBRO PARA LA CONDUCCIÓN EN CHILE(CONASET),1,si,"Usted va circulando a 65 km/h aproximadamente cuando, lamentablemente, atropella a un peatón. A esa velocidad, ....",Velocidad legal y segura,,"A una velocidad de 65 km/h , lo más probable es que el peatón fallezca.  Según los datos de seguridad vial utilizados en el examen:
A 30 km/h , el riesgo de muerte es de aproximadamente un 10%
A 50 km/h, el riesgo sube al .50%
A  poco más de 60 km/h , la probabilidad de que el peatón muera es de casi un 90%.
Esta es la razón principal por la cual el límite de velocidad en zonas urbanas se redujo a 50 km/h , buscando aumentar las posibilidades de supervivencia en caso de un atropello.

",,4,2,es seguro que el peatón.,no,es muy probable que el peatón  muera.,si,es seguro que el peatón sobreviva.,no,es muy probable que el peatón sobreviva.,no,,,,
199,LIBRO PARA LA CONDUCCIÓN EN CHILE(CONASET),1,si,"Usted desea adelantar a un motociclista que va delante suyo, ¿Que hace usted?",Sobrepaso de ciclistas,,"Al adelantar a un motociclista, usted debe realizar la maniobra de la misma forma que si se tratara de un automóvil, dejando el mayor espacio lateral posible. Las acciones clave son:
Usar la pista adyacente: Debe desplazarse completamente a la pista de la izquierda para asegurar un margen de seguridad amplio.
Mantener distancia lateral: Se recomienda dejar al menos 1,5 metros de separación, ya que los motociclistas pueden realizar movimientos bruscos por el viento o irregularidades en el pavimento.
No volver a la pista bruscamente: Regrese a su carril solo cuando vea al motociclista por su espejo retrovisor interior.
",,4,3,Trata de pasarlo en una curva.,no,Pasa cerca de él y lo mas rápido posible.,no,Le da tanto espacio lateral como le daría a un automóvil.,si,Le toca la bocina para advertir su presencia.,no,,,,
