question_id,topic,difficulty,is_active,question_text,reference_law,reference_book,feedback,image,total_options,correct_option_indexes,option_1_text,option_1_is_correct,option_2_text,option_2_is_correct,option_3_text,option_3_is_correct,option_4_text,option_4_is_correct,option_5_text,option_5_is_correct,option_6_text,option_6_is_correct
459,LIBRO PARA LA CONDUCCIÓN EN CHILE(CONASET),1,si,¿Donde no puede usted virar en U? Multirespuesta,Infracciones y sanciones,,"¿Qué dice la Ley de Tránsito sobre virar en U?
En el artículo número 141 de la Ley de Tránsito, se indica que se prohíbe efectuar virajes en «U» en los siguientes casos:

En las intersecciones de calles y caminos
En los pasos para peatones
A menos de 200 metros de las curvas, cimas o gradientes, cruces ferroviarios, puentes, viaductos y túneles
Donde la señalización lo prohíba
En tanto, en el artículo 199, se detalla que no respetar estas prohibiciones constituye una infracción menos grave.

Valor de la multa por virar en U
Por el tipo de falta que constituye, virar en U en lugares prohibidos por la ley significa una multa que va de las 0,5 a 1 UTM, ($24.400 a $48.000).",,4,"1, 2, 3, 4",En las intersecciones de calles y caminos,si,En los pasos para peatones,si,"A menos de 200 metros de las curvas, cimas o gradientes, cruces ferroviarios, puentes, viaductos y túneles",si,Donde la señalización lo prohíba,si,,,,
460,LIBRO PARA LA CONDUCCIÓN EN CHILE(CONASET),1,si,¿Qué es el punto ciego de un auto al conducir?,Espejos y puntos ciegos,,"Un punto ciego es un área alrededor de tu vehículo que permanece oculta de tu campo visual mientras conduces, incluso con los espejos retrovisores perfectamente ajustados.  

Estas zonas pueden esconder todo tipo de obstáculos y convertirse en un verdadero peligro en la carretera, provocando diversos accidentes de tráfico. Y es que, al no poder ver a otros vehículos, puedes cambiar de carril sin darte cuenta y provocar una colisión.  

Junto con esto, los puntos ciegos pueden ser especialmente peligrosos en maniobras como estacionar, salir de un estacionamiento o al realizar giros.",,3,3,Ceguera a la luz destellante del sol.,no,Bloqueo temporal por carga del espejo retrovisor.,no,"área alrededor de tu vehículo que permanece oculta de tu campo visual mientras conduces, incluso con los espejos retrovisores perfectamente ajustados.",si,,,,,,
461,LIBRO PARA LA CONDUCCIÓN EN CHILE(CONASET),1,si,¿Que sucede al aumentar la velocidad progresivamente? Marque dos.,Actuación en accidentes,,"El exceso de velocidad aumenta el tiempo necesario para frenar, eleva la probabilidad de que el conductor pierda el control del vehículo y disminuye la capacidad de anticiparse a probables peligros, por eso aumenta el riesgo de accidente y/o la gravedad de las lesiones cuando este ocurre.",,3,"1, 2",Disminuye el tiempo para la toma de decisiones.,si,Disminuye el tiempo para  reaccionar.,si,Aumenta el tiempo de reacción.,no,,,,,,
462,LIBRO PARA LA CONDUCCIÓN EN CHILE(CONASET),1,si,¿A que se refiere la percepción selectiva en la conducción?,Actuación en accidentes,,"La percepción selectiva en la conducción es la tendencia natural del cerebro a prestar atención solo a ciertos estímulos del entorno y pasar por alto otros, según lo que esperamos ver, nuestros intereses, experiencias previas o el nivel de concentración del momento.
🚗 ¿Por qué es importante en la conducción?

Porque al manejar estamos expuestos a mucha información simultánea: peatones, señales, luces, vehículos, sonidos, peligros, etc.
Como el cerebro no puede procesarlo todo al mismo tiempo, selecciona lo que considera más relevante.

Esto puede generar riesgos:

❌ Peligro 1: No ver lo inesperado

Ejemplo:
Si esperas que el cruce esté despejado, puedes no ver a un peatón o a un ciclista que aparece repentinamente.

❌ Peligro 2: Reaccionar tarde

Como no percibiste un estímulo a tiempo, tu reacción se retrasa, aumentando el riesgo de siniestro.

❌ Peligro 3: Confianza excesiva en “lo que debería haber”

El conductor cree que la vía está en determinadas condiciones, pero la realidad es otra.

✔️ Ejemplo del libro

En el análisis de una situación real, el conductor no vio a un peatón a tiempo porque su atención estaba dirigida a lo que esperaba encontrar, no a lo que realmente había.
El libro muestra este fenómeno como parte de las limitaciones visuales.",,3,3,Percibir todos los elementos del tránsito.,no,Mantener la atención en la pista.,no,Prestar atención solo a ciertos estímulos del entorno y pasar por alto otros,si,,,,,,
463,LIBRO PARA LA CONDUCCIÓN EN CHILE(CONASET),1,si,Se identifica en el libro del nuevo conductor que: (Marque dos),Estrés y distracción,,,,3,"1, 2",Los conductores jóvenes sobrestiman sus habilidades al conducir.,si,"Los menores de 18 y mayores de 65 años,  son más afectados por el consumo de alcohol.",si,Las mujeres conducen mas rápido.,no,,,,,,
464,LIBRO PARA LA CONDUCCIÓN EN CHILE(CONASET),1,si,Una alcoholemia de 0.31 gramos por litro de sangre de alcohol indica:,Alcohol,,"Una alcoholemia de 0.31 gramos por litro de sangre indica que el conductor se encuentra bajo la influencia del alcohol. Según la normativa vigente en Chile (Ley Tolerancia Cero), los estados se definen así:
Bajo la influencia del alcohol: De 0,31 a 0,79 gramos por mil de alcohol en la sangre.
Estado de ebriedad: De 0,80 o más gramos por mil de alcohol en la sangre.
Con , ya se supera el límite legal permitido para conducir sin sanciones, afectando principalmente los reflejos y la percepción de distancias.",questions/Emilia_uDb15q0.png,3,2,En estado de ebriedad.,no,Bajo la influencia del alcohol.,si,No pasa nada.,no,,,,,,
465,LIBRO PARA LA CONDUCCIÓN EN CHILE(CONASET),1,si,El alcohol se detecta 5 minutos después de haber sido ingerido. ¿En que tiempo alcanza su punto concentración máxima?,Alcohol,,"🧠 ¿Qué significa esto para la conducción?

El alcohol entra muy rápido al torrente sanguíneo, por lo que sus efectos pueden aparecer Rápidamente. Aunque aún no sientas síntomas, ya puede afectar tu capacidad de reacción y percepción.
La alcoholemia sigue aumentando hasta cerca de 1 hora después de beber, alcanzando su punto máximo.",,3,3,A los 30 minutos.,no,A los 15 minutos.,no,a los 60 minutos.,si,,,,,,
466,LIBRO PARA LA CONDUCCIÓN EN CHILE(CONASET),1,si,"Reincidencia por conducir en estado de ebriedad en tres ocasiones, procede:",Alcohol,,"Según el Libro para la Conducción en Chile (Clase B), cuando una persona reincide por tercera vez conduciendo en estado de ebriedad, la sanción es la cancelación de la licencia de conducir, es decir, pierde definitivamente su licencia.

Esto aparece en el cuadro de sanciones por alcohol:

En la columna de “3era vez” para estado de ebriedad, la sanción indicada es:
“Cancelación” (de la licencia).",,3,3,Multa y cárcel.,no,Multas 3 utm.,no,Cancelación de la licencia.,si,,,,,,
467,LIBRO PARA LA CONDUCCIÓN EN CHILE(CONASET),1,si,Al transitar por una carretera con densa niebla. ¿Que hace usted para aumentar la seguridad en la vía? Multirespuesta.,Luces altas y bajas,,"Conducción con densa niebla
La niebla reduce drásticamente la visibilidad y también la adherencia, ya que humedece el pavimento, incrementando el riesgo de deslizamiento.
Cuando la niebla es muy espesa, prácticamente elimina la visibilidad.

1. Luces que debes usar
Encender luces bajas: se ven mejor porque iluminan hacia el suelo.
No usar luces altas: la niebla refleja la luz como un espejo y empeora la visibilidad.
Encender focos neblineros delanteros (si el vehículo los posee), siempre junto con luces bajas.
Luces de niebla traseras ayudan a que te vean, pero deben usarse solo con visibilidad realmente reducida.

Las luces neblineras solo pueden usarse cuando la visibilidad está considerablemente reducida y deben apagarse al mejorar las condiciones.

2. Velocidad y distancia
Reduce la velocidad para poder detenerte dentro del tramo que alcanzas a ver.
Aumenta considerablemente la distancia con el vehículo que va adelante.
La falta de adherencia aumenta la distancia de frenado.
Evita frenadas bruscas; el pavimento húmedo favorece el deslizamiento.

3. Maniobras y adelantamientos
No adelantes si la visibilidad no permite ver con claridad hacia adelante.
Mantente cerca del borde derecho de la calzada para evitar riesgos por maniobras erróneas de otros.
(Relevante en visibilidad reducida.)

4. Guía visual
Pon especial atención a las demarcaciones (líneas centrales y de borde) para mantener tu trayectoria.

5. Paradas y detenciones
Evita detenerte en la calzada, porque la visibilidad reducida puede generar colisiones con vehículos que no te vean a tiempo.

6. Actitud general
La niebla requiere calma y no intentar ver más de lo que realmente puedes ver.",questions/niebla.png,4,"1, 2, 3",Reduce la velocidad.,si,Aumentar la distancia del vehículo que va adelante.,si,Encender luces bajas y neblineros si su vehículo los tiene.,si,Mantiene la velocidad.,no,,,,
468,LIBRO PARA LA CONDUCCIÓN EN CHILE(CONASET),1,si,Huir del lugar de un siniestro en que haya participado será sancionado con:,Actuación en accidentes,,"Si te fugas de un accidente de tránsito en el que se producen daños, sin dar cuenta a la autoridad más cercana, serás sancionado con: Multa de 3 a 7 UTM ($205.941 a $480.529, según el valor de la UTM de agosto de 2025, cuando 1 UTM equivale a $68.647). Suspensión de la licencia hasta por 1 mes.",,3,3,Multa.,no,Multa y retiro del vehículo.,no,Multa de 3 a 7 UTM y suspensión de la licencia por un mes,si,,,,,,
469,LIBRO PARA LA CONDUCCIÓN EN CHILE(CONASET),1,si,Si en un  túnel debes pedir asistencia. ¿Como lo haría?,Neblina,,"Si tu vehículo sufre una falla, queda detenido o te encuentras en una situación de peligro, el procedimiento seguro es el siguiente:

1. Detén el vehículo solo si es estrictamente necesario
Oríllate lo más a la derecha posible, sin invadir la calzada más de lo inevitable.
No retrocedas ni intentes girar dentro del túnel.
Esto se fundamenta en que las detenciones en lugares de baja visibilidad son peligrosas (principio aplicado a la niebla y extensible a túneles).

2. Enciende las luces de advertencia de peligro
Las luces de emergencia se usan cuando el vehículo está detenido por una falla para advertir a quienes vienen detrás.

3. Permanece dentro del vehículo si es más seguro
En un túnel, lo más peligroso es caminar por la calzada.
Sal únicamente si existe una zona segura, como: Nichos de emergencia, pasillos laterales de protección.

Salidas señalizadas.
Muchos túneles modernos tienen:
Teléfonos SOS.

Cámaras.

Sistemas automáticos de asistencia.

4. Utiliza los teléfonos SOS o puntos de auxilio del túnel (si existen)
Generalmente, están ubicados cada cierta distancia.
Te conectan directamente con la concesionaria o centro de control del túnel.

5. Si no existen teléfonos SOS, contacta asistencia desde tu celular
Hazlo sin caminar por el túnel y manteniendo las luces de emergencia encendidas.
Llama a: 103 (emergencia de autopistas concesionadas, donde aplique). Asistencia de tu seguro.
Carabineros (133) si se trata de un riesgo mayor.

6. Mantén las luces encendidas y el motor apagado si estás detenido por falla debes ser visible.
Mantén el vehículo cerrado y con cinturón si se percibe tránsito cercano.

Resumen operativo
Oríllate a la derecha y detente solo si es inevitable.
Activa luces de emergencia.
Evalúa si es seguro permanecer en el vehículo; evita caminar.
Usa teléfonos SOS del túnel o llama desde el celular sin ponerte en riesgo.
Espera asistencia en un lugar seguro.",,3,3,Enarbolando un chaleco reflectante.,no,Llamar a un familiar.,no,Acercarse a teléfono S.O.S dispuesto en los túnel.,si,,,,,,
470,LIBRO PARA LA CONDUCCIÓN EN CHILE(CONASET),1,si,Ante una falla total del freno principal (Freno de pedal) usted puede: (Marque dos),Fallas de frenos,,"Cuando el pedal se va al fondo sin ofrecer resistencia, el libro indica que debes aplicar, progresivamente, las siguientes maniobras (si una no funciona, continúas con la siguiente):

Circular lo más cerca posible del lado derecho de la calzada y avisar del problema
Usa luces de emergencia o bocina para advertir la falla.
Suelta el acelerador y reduce a cambios más bajos secuencialmente
Esto permite que el motor frene el vehículo.
Usar el freno de mano, pero siempre en forma suave y progresiva
Evita bloquear las ruedas para no perder el control.
Buscar una pista de emergencia (si existe en el camino)
Es el método más seguro para detener el vehículo cuando no se dispone de frenos.
Si hay peligro inminente, puedes rozar el vehículo contra un borde, arbustos, cuneta o defensa caminera esto genera fricción para reducir la velocidad.
No apagues el motor, ya que perderías la dirección asistida.
(Adicional del mismo apartado) Si sospechas sobrecalentamiento, suelta el pedal y deja ventilar el sistema, usando el motor para frenar.",,3,"1, 2",Bajar marchas progresivamente (Frenado de motor),si,Usar freno de servicio (Freno de Mano) en forma suave y progresiva,si,Bombear el pedal hasta que funcione.,no,,,,,,
471,LIBRO PARA LA CONDUCCIÓN EN CHILE(CONASET),1,si,¿Como afecta un alto grado de estrés  a una persona conductora?,Fatiga y sueño,,"1. Disminuye la concentración
El estrés desvía la atención hacia preocupaciones internas, reduciendo la capacidad de observar el entorno vial.
El libro señala que problemas emocionales, disgustos o distracciones internas afectan negativamente la seguridad del tránsito.

2. Aumenta el tiempo de reacción
Una persona estresada tarda más en procesar información y responder ante un imprevisto, lo que reduce el margen para evitar accidentes.

3. Genera decisiones impulsivas o erróneas, el estrés favorece conductas como:
Acelerar innecesariamente, frenar de forma brusca, cambiar de carril sin evaluar correctamente.
El manual muestra que los estados emocionales negativos deterioran la toma de decisiones al volante.

4. Reduce la capacidad de anticipación, el conductor estresado tiende a fijarse en estímulos inmediatos y deja de prever riesgos, lo que es crítico en zonas urbanas y caminos rápidos.

5. Aumenta el riesgo de distracción, el estrés compite con las tareas de conducción:
Menor atención a señales y peatones, mayor probabilidad de pasar por alto peligros.
El libro advierte que cualquier distracción reduce el tiempo disponible para reaccionar.

6. Fatiga mental, el estrés sostenido genera cansancio cognitivo, que se traduce en menos precisión y más errores de coordinación.

Conclusión clave
Un alto grado de estrés deteriora seriamente la capacidad de conducir con seguridad, aumentando el riesgo de siniestros debido a menor concentración, peor capacidad de reacción, decisiones impulsivas y distracciones.",,3,3,Conduce a la defensiva.,no,Conduce lentamente.,no,Es impulsiva y empeora la capacidad de reacción.,si,,,,,,
472,LIBRO PARA LA CONDUCCIÓN EN CHILE(CONASET),1,si,A medida que aumenta la velocidad..,Actuación en accidentes,,"A medida que aumenta la velocidad:

La distancia de frenado aumenta en forma cuadrática.
La distancia de detención aumenta.
Se reduce el campo visual.
Aumenta la energía del impacto y la gravedad de un siniestro.",,3,3,Su reacción es mas rápida.,no,Su control es mayor.,no,Reduce su campo visual. (visión de túnel),si,,,,,,
473,LIBRO PARA LA CONDUCCIÓN EN CHILE(CONASET),1,si,¿En que circunstancias se retirara el vehículo de circulación?,Documentación obligatoria,,"1. Cuando el vehículo no cumple condiciones técnicas o de seguridad
 Luces en mal estado,  frenos deficientes, neumáticos en mal estado, dirección defectuosa.
Emite ruidos o gases excesivos.

2. Cuando carece de documentos obligatorios se retira si el vehículo:
No tiene permiso de circulación vigente.
No tiene revisión técnica o análisis de gases vigente.
No tiene seguro obligatorio (SOAP).
Estas son faltas gravísimas y permiten el retiro inmediato.

3. Cuando el vehículo circula con patente adulterada, falsa o sin placa patente
Se considera un ilícito grave y el retiro es inmediato.

4. Cuando el vehículo es abandonado en la vía pública
Si estorba el tránsito o representa peligro.

5. Cuando participa en un siniestro y queda en condiciones que lo hacen inseguro
Si por los daños no puede circular sin riesgo

6. Cuando transporta carga de forma peligrosa si la carga:
Sobresale indebidamente, no está asegurada , compromete la estabilidad del vehículo.

7. Cuando el conductor es sorprendido manejando en estado de ebriedad o bajo drogas y no hay conductor habilitado, la autoridad puede retirar el vehículo por seguridad si no existe otra persona legalmente capaz de continuar la marcha.

8. Cuando se realizan carreras clandestinas o competencias no autorizadas
Retiro inmediato por orden de la Ley de Tránsito.

9. Cuando el vehículo obstaculiza gravemente el tránsito
Ejemplo: bloquear vías, accesos de emergencia, intersecciones o puentes.",,3,3,Cuando circule con luces bajas en zona urbana.,no,Cuando no tenga el padrón a mano.,no,"Por circular sin placa patente, revisión técnica vencida, sin permiso de circulación o sin seguro obligatorio.",si,,,,,,
474,LIBRO PARA LA CONDUCCIÓN EN CHILE(CONASET),1,si,¿Que indica la ley 18290 art. 71?,Uso general de luces,,"""Artículo 71.- Se prohíbe el uso, adosamiento o la conducción con luces o focos distintos o adicionales a los permitidos por la ley o sus reglamentos"".
Sólo los vehículos de emergencia y los demás que determine el reglamento que se dicte podrán o deberán estar provistos de dispositivos luminosos, fijos o giratorios, y su uso se sujetará a lo que el reglamento respectivo determine.",,3,3,Que no puedes usar neblineros.,no,Que no debes usar  luces amarillas o blancas.,no,Que no se bebe usar focos distintos o adicionales a los permitidos por la ley o sus reglamentos.,si,,,,,,
475,LIBRO PARA LA CONDUCCIÓN EN CHILE(CONASET),1,si,"Al tomar una curva, ¿qué factor influye más en el aumento de la fuerza centrífuga que empuja el vehículo hacia el exterior de la curva?",Hielo y baja adherencia,,"Factores que influyen en la fuerza centrífuga al tomar una curva
1. La velocidad del vehículo (el factor más importante)
La fuerza centrífuga aumenta con el cuadrado de la velocidad.
Esto significa que si duplicas la velocidad, la fuerza que empuja el vehículo hacia fuera se cuadruplica.
Por lo tanto, a mayor velocidad, mayor riesgo de derrapar o volcar.

2. El radio de la curva (qué tan cerrada es)
Curvas cerradas → radio pequeño → mayor fuerza centrífuga.
Curvas suaves o amplias → radio grande → fuerza menor.

3. La adherencia entre neumáticos y calzada depende de:
Estado del pavimento (mojado, con gravilla, hielo).
Estado de los neumáticos (desgaste, presión correcta).
Tipo de superficie.
Menor adherencia = mayor probabilidad de que la fuerza centrífuga haga perder el control.

4. El centro de gravedad del vehículo
Vehículos altos (SUV, camionetas) tienen mayor riesgo de volcamiento.
Vehículos bajos tienen mayor estabilidad.

5. Carga y distribución del peso
Una mala distribución de la carga aumenta el riesgo de inestabilidad, especialmente al tomar curvas.

Conclusión de examen
La fuerza centrífuga aumenta principalmente con la velocidad, disminuye con un mayor radio de la curva y depende de la adherencia y del centro de gravedad del vehículo.",,3,3,El viento.,no,El estado de las luces.,no,La velocidad y el radio de la curva.,si,,,,,,
476,LIBRO PARA LA CONDUCCIÓN EN CHILE(CONASET),1,si,Al salir de un túnel debo estar muy atento. ¿Por Que?,Sobrepaso de ciclistas,,"Uno de los principales riesgos es la ceguera temporal, que ocurre por el contraste brusco entre la oscuridad del túnel y la luz intensa del exterior, esto puede reducir la distancia de visibilidad y aumentar el riesgo de atropellos o colisiones. Además, al salir de un túnel pueden aparecer obstáculos inesperados, como vehículos detenidos, peatones, ciclistas o cambios en la calzada. La falta de tiempo para reaccionar, combinada con la ceguera momentánea, puede ser fatal si no se toman precauciones. Por ello, es fundamental reducir la velocidad antes de la salida y mantener ambas manos en el volante, anticipando cualquier imprevisto en el camino.",questions/tunel.png,3,2,La Vía es más ancha y tiene mas pistas.,no,Por el efecto de ceguera temporal.,si,Por que la velocidad aumenta.,no,,,,,,
477,LIBRO PARA LA CONDUCCIÓN EN CHILE(CONASET),1,si,"¿Relacionado con la conducción, que efectos en el organismo provoca el consumo de alcohol? Multirespuesta.",Alcohol,,"Relacionado con la conducción, el consumo de alcohol provoca múltiples efectos negativos en el organismo, además de la evidente disminución de la capacidad para conducir. Entre los principales efectos se encuentran:

Disminución de los reflejos: aumenta el tiempo de reacción ante imprevistos.
Alteración de la percepción: se distorsionan las distancias, la velocidad y el movimiento de otros Vehículos.
Pérdida de coordinación motora: dificulta maniobras precisas como frenar, acelerar o mantener la pista.
Reducción de la atención y concentración: se incrementa la distracción y la conducción automática.
Falsa sensación de seguridad: el alcohol desinhibe y lleva a asumir riesgos innecesarios.
Deterioro del juicio: se toman decisiones incorrectas, como exceder la velocidad o no respetar señales.
Somnolencia y fatiga: especialmente peligrosa en trayectos largos o nocturnos.

En síntesis, el alcohol afecta directamente el sistema nervioso central, comprometiendo las capacidades físicas y mentales indispensables para una conducción segura, incluso en cantidades aparentemente bajas.",,4,"1, 2, 3",Somnolencia y fatiga,si,Alteración de la percepción,si,Reducción de la atención y concentración,si,Aumento control de emociones.,no,,,,
478,LIBRO PARA LA CONDUCCIÓN EN CHILE(CONASET),1,si,"¿Señales de transito, transitorias donde se visualizan regularmente?",Incendio del vehículo,,"Lugares donde se observan con mayor frecuencia

Zonas de trabajos viales

Reparación de calzadas

Pavimentación

Mantención de puentes o túneles

Desvíos temporales

Calles o pistas cerradas por obras

Accidentes de tránsito

Eventos especiales (corridas, actos públicos)

Emergencias o siniestros

Accidentes de tránsito

Incendios

Derrumbes o inundaciones

Controles policiales o de fiscalización

Controles de velocidad

Alcohol y drogas

Aduanas o peajes temporales

Trabajos de servicios

Instalación o reparación de cables eléctricos

Agua potable, alcantarillado o gas

Características relevantes

Generalmente de color amarillo o fondo naranja

Pueden ser portátiles o móviles

Tienen carácter obligatorio mientras estén instaladas

Prevalecen sobre la señalización permanente, salvo indicación de Carabineros

En conducción, estas señales exigen mayor atención, reducción de velocidad y obediencia estricta, ya que buscan proteger tanto a los usuarios de la vía como a los trabajadores.",questions/señaltransitoria.png,3,3,En un cruce regulado.,no,En cruce señalizado.,no,En obras viales generalmente dispuestas a lo largo de la obra.,si,,,,,,
479,LIBRO PARA LA CONDUCCIÓN EN CHILE(CONASET),1,si,¿Como definimos seguridad activa?,Elementos de seguridad,,"Características clave
Actúa antes del accidente
Depende tanto del estado mecánico del vehículo como del comportamiento del conductor
Reduce la probabilidad de perder el control o colisionar

En síntesis, la seguridad activa busca prevenir el accidente, a diferencia de la seguridad pasiva, que actúa cuando el siniestro ya se ha producido.",,3,1,"El conjunto de sistemas, dispositivos y condiciones del vehículo y de la conducción que tienen por finalidad evitar que ocurra un siniestro de tránsito.",si,La comprensión de la ley de tránsito y su acción.,no,La actuación de un conductor seguro.,no,,,,,,
480,LIBRO PARA LA CONDUCCIÓN EN CHILE(CONASET),1,si,Para controlar su vehículo ¿Como debe tomar el volante?,Control y maniobra,,Siempre con las dos manos al volante.,,3,3,Con una mano firme y la otra libre para pasar cambios.,no,Con una mano y la otra disponible en caso operar algún comando.,no,Siempre con las dos manos excepto el momento mínimo requerido para cambiar marchas.,si,,,,,,
481,LIBRO PARA LA CONDUCCIÓN EN CHILE(CONASET),1,si,Al observar a una persona de la tercera edad conduciendo ¿Que apreciación debe usted tener?,Distancia de reacción y frenado,,"En términos prácticos, la apreciación correcta es:

Anticipar maniobras: puede reaccionar con mayor lentitud ante estímulos del tránsito.
Mantener mayor distancia de seguridad, evitando presionarla o apurarla.
Ser paciente y tolerante, ya que puede conducir a menor velocidad o realizar maniobras con más cautela.
No discriminar ni subestimar, recordando que su derecho a conducir es el mismo que el de cualquier otro conductor mientras esté apto legalmente.
En síntesis, se debe conducir de forma preventiva, colaborando a un tránsito más seguro y respetuoso para todos.",questions/tata.png,3,1,Estar consciente de que sus reacciones son mas lentas.,si,Que son excelentes conductores.,no,Que conducen por la izquierda.,no,,,,,,
